{
  "schema": 1,
  "id": "arm-more-sext8",
  "arch": "aarch64",
  "description": "byte=state&255; extended=byte<128?byte:byte-256 modulo2^64; state=extended+0x9e3779b97f4a7c15",
  "category": "latency",
  "variants": [
    {
      "id": "baseline",
      "source": "asm/arm-more-sext8-baseline.S",
      "symbol": "pattern_kernel"
    },
    {
      "id": "candidate",
      "source": "asm/arm-more-sext8-candidate.S",
      "symbol": "pattern_kernel"
    }
  ],
  "oracle": {
    "source": "oracles/more-sext8.c",
    "symbol": "pattern_oracle"
  },
  "data_words": 1,
  "mask": 0,
  "seeds": [
    0,
    1,
    9,
    10,
    11,
    127,
    128,
    255,
    256,
    9223372036854775807,
    9223372036854775808,
    18446744073709551615
  ],
  "correctness_iterations": [
    0,
    1,
    2,
    17,
    257
  ],
  "work_per_iteration": 1,
  "work_unit": "state_update",
  "notes": [
    "All arithmetic wraps modulo 2^64; zero iterations return seed without data access.",
    "Work counts one semantic update or load per iteration, not executed instructions. Actual loop work determines the returned state.",
    "Sign extend the low byte to 64 bits, then add salt 0x9e3779b97f4a7c15 modulo 2^64.",
    "Data and mask are unused. Constant setup is outside the loop; MCA assumes constants already materialized."
  ],
  "mca": {
    "baseline": {
      "source": "mca/arm-more-sext8-baseline.s"
    },
    "candidate": {
      "source": "mca/arm-more-sext8-candidate.s"
    }
  }
}
