{
  "schema": 1,
  "id": "arm-address-load",
  "arch": "aarch64",
  "description": "Dependent data load through byte-index address selection.",
  "category": "memory",
  "variants": [
    {
      "id": "original",
      "source": "asm/arm-address-load-original.S",
      "symbol": "pattern_kernel"
    },
    {
      "id": "compact",
      "source": "asm/arm-address-load-compact.S",
      "symbol": "pattern_kernel"
    },
    {
      "id": "paddedfold",
      "source": "asm/arm-address-load-paddedfold.S",
      "symbol": "pattern_kernel"
    }
  ],
  "oracle": {
    "source": "oracles/address-load.c",
    "symbol": "pattern_oracle"
  },
  "data_words": 512,
  "mask": 255,
  "seeds": [
    0,
    1,
    18446744073709551615
  ],
  "correctness_iterations": [
    0,
    1,
    2,
    17,
    257
  ],
  "work_per_iteration": 1,
  "work_unit": "uint64_load",
  "notes": [
    "Each iteration: index=((state>>16)&255)&mask; state=data[2*index].",
    "mask255 requires512 allocated uint64 words: final accessed byte4087.",
    "Paddedfold preserves original instruction slots with two NOPs; not a pure dependency isolator.",
    "Model is a microexperiment inspired by reviewed E3 byte-range proof; no whole-application gain claim."
  ],
  "mca": {
    "original": {
      "source": "mca/arm-address-load-original.s"
    },
    "compact": {
      "source": "mca/arm-address-load-compact.s"
    },
    "paddedfold": {
      "source": "mca/arm-address-load-paddedfold.s"
    }
  }
}
