{
  "schema": 1,
  "id": "arm-more-branch-select",
  "arch": "aarch64",
  "description": "bit=data[(state>>8)&mask]&1; state=state+(bit?3:5) modulo2^64",
  "category": "control",
  "variants": [
    {
      "id": "baseline",
      "source": "asm/arm-more-branch-select-baseline.S",
      "symbol": "pattern_kernel"
    },
    {
      "id": "candidate",
      "source": "asm/arm-more-branch-select-candidate.S",
      "symbol": "pattern_kernel"
    }
  ],
  "oracle": {
    "source": "oracles/more-branch-select.c",
    "symbol": "pattern_oracle"
  },
  "data_words": 256,
  "mask": 255,
  "seeds": [
    0,
    1,
    9,
    10,
    11,
    127,
    128,
    255,
    256,
    9223372036854775807,
    9223372036854775808,
    18446744073709551615
  ],
  "correctness_iterations": [
    0,
    1,
    2,
    17,
    257
  ],
  "work_per_iteration": 1,
  "work_unit": "conditional_update",
  "notes": [
    "All arithmetic wraps modulo 2^64; zero iterations return seed without data access.",
    "Work counts one semantic update or load per iteration, not executed instructions. Actual loop work determines the returned state.",
    "The ordinary allocated load supplies bit zero; add 3 when set, otherwise add 5.",
    "CSEL uses flags from TST; both nontrapping integer alternatives use non-flag-setting ADD before selection. Counter flags are separate.",
    "MCA intentionally omitted: a straight-line extract does not model the data-dependent branch-path mixture. Fixed driver data does not establish branch predictability.",
    "Index is (state >> 8) & mask, scaled by eight; mask 255 and 256 words bound the final 8-byte load to offsets 2040..2047. Data pointer and mask remain unchanged."
  ]
}
