{
  "schema": 1,
  "id": "x86-more-branch-select",
  "arch": "x86_64",
  "description": "bit=data[(state>>8)&mask]&1; state=state+(bit?3:5) modulo2^64",
  "category": "control",
  "variants": [
    {
      "id": "baseline",
      "source": "asm/x86-more-branch-select-baseline.S",
      "symbol": "pattern_kernel"
    },
    {
      "id": "candidate",
      "source": "asm/x86-more-branch-select-candidate.S",
      "symbol": "pattern_kernel"
    }
  ],
  "oracle": {
    "source": "oracles/more-branch-select.c",
    "symbol": "pattern_oracle"
  },
  "data_words": 256,
  "mask": 255,
  "seeds": [
    0,
    1,
    9,
    10,
    11,
    127,
    128,
    255,
    256,
    9223372036854775807,
    9223372036854775808,
    18446744073709551615
  ],
  "correctness_iterations": [
    0,
    1,
    2,
    17,
    257
  ],
  "work_per_iteration": 1,
  "work_unit": "conditional_update",
  "notes": [
    "Baseline AMD64 System V/Darwin caller-saved leaf ABI; zero iterations returns seed without data access.",
    "All state arithmetic wraps modulo 2^64; actual loop work feeds the returned state.",
    "Both variants load bit=data[(state>>8)&mask]&1, then add 3 for bit one or 5 for bit zero modulo 2^64.",
    "Both candidate values use nontrapping LEA; TEST sets the flags consumed by CMOV after value formation.",
    "The RDX data pointer remains live; mask 255 and 256 words bound every 8-byte load within the ordinary allocation.",
    "MCA intentionally omitted: a straight-line extract cannot model the data-dependent branch-path mixture.",
    "The current fixed driver stream does not establish branch predictability or whole-application behavior."
  ]
}
