{
  "schema": 1,
  "id": "arm-more-rotate",
  "arch": "aarch64",
  "description": "state = rotr64(state,13) XOR 0x9e3779b97f4a7c15",
  "category": "latency",
  "variants": [
    {
      "id": "baseline",
      "source": "asm/arm-more-rotate-baseline.S",
      "symbol": "pattern_kernel"
    },
    {
      "id": "candidate",
      "source": "asm/arm-more-rotate-candidate.S",
      "symbol": "pattern_kernel"
    }
  ],
  "oracle": {
    "source": "oracles/more-rotate.c",
    "symbol": "pattern_oracle"
  },
  "data_words": 1,
  "mask": 0,
  "seeds": [
    0,
    1,
    9,
    10,
    11,
    127,
    128,
    255,
    256,
    9223372036854775807,
    9223372036854775808,
    18446744073709551615
  ],
  "correctness_iterations": [
    0,
    1,
    2,
    17,
    257
  ],
  "work_per_iteration": 1,
  "work_unit": "state_update",
  "notes": [
    "All arithmetic wraps modulo 2^64; zero iterations return seed without data access.",
    "Work counts one semantic update or load per iteration, not executed instructions. Actual loop work determines the returned state.",
    "Rotate right by 13, then XOR salt 0x9e3779b97f4a7c15; split shifts operate on the same original state.",
    "Data and mask are unused. Constant setup is outside the loop; MCA assumes constants already materialized."
  ],
  "mca": {
    "baseline": {
      "source": "mca/arm-more-rotate-baseline.s"
    },
    "candidate": {
      "source": "mca/arm-more-rotate-candidate.s"
    }
  }
}
