{
  "schema": 1,
  "id": "x86-more-rotate",
  "arch": "x86_64",
  "description": "state = rotr64(state,13) XOR 0x9e3779b97f4a7c15",
  "category": "latency",
  "variants": [
    {
      "id": "baseline",
      "source": "asm/x86-more-rotate-baseline.S",
      "symbol": "pattern_kernel"
    },
    {
      "id": "candidate",
      "source": "asm/x86-more-rotate-candidate.S",
      "symbol": "pattern_kernel"
    }
  ],
  "oracle": {
    "source": "oracles/more-rotate.c",
    "symbol": "pattern_oracle"
  },
  "data_words": 1,
  "mask": 0,
  "seeds": [
    0,
    1,
    9,
    10,
    11,
    127,
    128,
    255,
    256,
    9223372036854775807,
    9223372036854775808,
    18446744073709551615
  ],
  "correctness_iterations": [
    0,
    1,
    2,
    17,
    257
  ],
  "work_per_iteration": 1,
  "work_unit": "state_update",
  "notes": [
    "Baseline AMD64 System V/Darwin caller-saved leaf ABI; zero iterations returns seed without data access.",
    "All state arithmetic wraps modulo 2^64; actual loop work feeds the returned state.",
    "The shift/OR pair is a 64-bit rotate right by 13; both variants XOR the same salt.",
    "MCA contains the actual straight-line body only, including result moves; entry, constant setup, loop control and return are excluded. Constants and mask are assumed ready; body flags are discarded by loop control. No model fidelity or performance win is claimed."
  ],
  "mca": {
    "baseline": {
      "source": "mca/x86-more-rotate-baseline.s"
    },
    "candidate": {
      "source": "mca/x86-more-rotate-candidate.s"
    }
  }
}
